ID,Type,Utterance,Dialog_Act,Dialog_Act_1,Emotion,Dialog_Act_Label
1_0,P,I think I want to eat healthy.,id,,,0
1_1,P,I want to completely cut out fast food. I want to have more set meals and I just want to eat healthy food. Okay.,id,,,0
1_2,P,I think I at least needs to go to the grocery. Okay.,id,,,0
1_3,T,Is that something that you haven't been doing?,irq,,,1
1_4,P,"No, not lately. I've just been grabbing food at work, or going through fast food on the way home. Okay.",id,,,0
1_5,P,"Like, I just haven't had the energy or desire to go and I've also been been working a lot trying to save up money for the baby. Finding the time might be hard. Okay,",id,,,0
1_6,P,"I used to go every week on Sunday. And I used to already have a list in mind before I went,",id,,,0
1_7,P,That would probably make it more likely for me to go. I don't have to be at work until the afternoon that day. So I can maybe go asleep and a little bit maybe at like 10 o'clock on Sunday.,id,,,0
1_8,P,"Well, lately when I haven't felt like doing things that I really need to do, I'll give myself a reward. And I know that there's this great bakery on the way. So if I tell myself, if I go to the grocery, then I can stop by the bakery on the way home, then I may be more likely to go.",id,,,0
10_0,T,"Hello stone, ",gt,,,2
10_1,P,yes.,gt,,,2
10_2,T,"Hi, I'm PJ Daniels. Sorry, let me wash my hands.",gc,,,3
10_3,P,"Call me, Dorothy.",gc,,,3
10_4,T,"Oh, thank you. That's the next thing I was going to ask you. So Dorothy, the nurse mentioned to me that you wanted to talk about your care is but what's going on?",irq,,,1
10_5,P,"Five days ago, I was admitted to emergency. And they treated me by putting this tube down my throat. And I tried to, to tell them and gesture at them that I don't want this tube down my throat. And I just hope that never happens again.",id,,,0
10_6,T,"Okay. No, I totally understand that. I mean, that is quite a scary thing to go through. And I think we do need to talk about this more, and I'm glad that you've asked it. Talk to me about this. So I had a little bit of a look through your charts. I think I understand why they did it. But did anybody explain it to you?",irq,,,1
10_7,P,"Well, not really. And because I was gasping for air and in the state I was, but I'll tell you what, I'm really worried that this won't happen to me again. I don't want that to be anymore. I'm, I'm okay to to pass this. ",id,,,0
10_8,T,"Absolutely. And you know what? There's no right answer when it comes to deciding on things that are aggressive, like the two, we really want to know what the patient values in terms of, you know, things that are that invasive, and so absolutely will respect whatever it is that you want. But I do need to find out a little bit more about you in terms of what is your understanding of what brought you into hospital.",irq,,,1
10_9,P,"Well, I have congested Part failure. And I guess there was water in my lungs and stopping me from breathing properly. So I was living in my soul, the ambulance brought me in to the emergency. So they that was how they were treating me.",id,,,0
10_10,T,So you pretty much showed up to emergency. And very quickly they put that tube down.,irq,,,1
10_11,P,That's correct.,id,,,0
10_12,T,Did anybody ask you if you were okay with that?,irq,,,1
10_13,P,"Well, I tried to gesture to them that I don't want the tube but",id,,,0
10_14,T,they didn't quite pick up on that.,irq,,,1
10_15,P,"I guess not. And, you know, I've had that three times already. I don't want to go through with",id,,,0
10_16,T,the two you've had.,irq,,,1
10_17,P,Yes. I don't want it anymore.,id,,,0
10_18,T,"Okay. And so so you have congestive heart failure, and it sounds like you've got a breathing problem. Yes. And do you know why they would have put the tube down. Do you know what they were trying to do?",irq,,,1
10_19,P,"I guess because I was short of air. I had a hard time breathing, right? So they tried to, like, I'm going to use the word save me.",id,,,0
10_20,T,"Right. So it sounds like you understand that. I mean, usually we only put a tube in. If that was the only thing we could do to save you. Most of the time of congestive heart failure. We'll give some medications. Have you heard of lasix? Or furosemide? No, okay. It's a medication will often give if someone is in heart failure, but if someone is really sick, and then we don't think we have time to give it that's the time we would think of a breathing tube. haven't had a chance to look through the chart, but it would suggest to me you were pretty close to dying when you came in.",irq,,,1
10_21,P,"I I guess so. But I'm okay with dying. Okay. You know, like I says, I've lived a good life and if it If the good Lord says that it's my time, I'm okay with that. And you wouldn't put it to",id,,,0
10_22,T,"No, my know already what I'm hearing from you. Exactly. I'm just gonna say exactly what you've said, sounds like you've lived a good life. You've been through this a few times, you know exactly what it involves. And if I could paraphrase to you quality of life is more important than quantity at this stage. Is that correct?",irq,,,1
10_23,P,"That is correct. And, but you know, what, doctor? How can I be assured that my wishes are respected, so I don't get this tube down?",id,,,0
10_24,T,"That's an excellent question. So first, I did want to answer your previous question, based on what we're talking about. Absolutely. I agree with you that it is your wish, and we will respect that wish that we're not going to put a breathing tube down again. And then of course, your second question, which is great, as well as how do we make sure this doesn't happen? So what I'm going to do after our conversation, and I do have a few more questions, To ask you but after conversation, I write a note documenting what we talked about that we talked about the breathing too. And your reasons for why you don't want it, which of course makes sense to me. And then what I do is I document a short form called goals of care. And I just so it's a really easy way for everyone to look at the form and in two seconds, I know exactly what you want, we will give you a copy of that to take home. But I find that's not usually enough. What we also do, what I do is I tend to when you leave hospital, dictate a note to your family doctor. And that notes actually available online for anyone who might see you in any emergency department in Alberta. And in that note will very clearly state you and I have this conversation and you really didn't want the breathing to so I reassure you, we'll do everything we can to make sure people understand you don't want that to Okay.",irq,,,1
10_25,P,"All Thank you. I'm I was so concerned about that and yes, I I think I will rest now because like I say, that was a horrendous experience. And he says it won't happen again.",id,,,0
10_26,T,"Okay. I do want to ask you just a few other questions related to this. Go ahead. And the first question might sound a little off putting, but I sort of have to ask it anytime someone is changing the kind of therapy they want. We do have to ask, how was your mood? How are you feeling?",irq,,,1
10_27,P,I'm I'm feeling fine. My mood is fine. I have no no problems.,id,,,0
10_28,T," Okay, excellent. And how are you feeling overall about life before you came into hospital? Like when you're healthy as healthy as you can be? Say a few weeks ago?",irq,,,1
10_29,P,"I think I am enjoying life. Okay. Yes, I am enjoying life to the to the best I can. ",id,,,0
10_30,T,"Okay, great. Yeah. And then other related questions, we did talk about the two that we wouldn't put it in. But again, we want to make sure we know everything that you might want or not want. Okay? So if we had to give you medications to get your breathing better, is that something you'd be willing to have?",irq,,,1
10_31,P,"Certainly, Oh, yes. Oh, look at medication, just not the intubation.",irq,,,1
10_32,T,"Okay. And then usually along the lines with the intubation when people don't want the intubation, we often also want to know, if a nurse were to walk into the room and find just by bad luck, you would pass away or if someone just found you at home, who had passed away. Would you ever want people pushing on your chest and giving you shocks trying to bring you back to life?",irq,,,1
10_33,P,"No, no, no, I like I said, the good Lord knows when it's my time.",id,,,0
10_34,T,"No, and that'll make sense to me with no breathing.",irq,,,1
10_35,P,"Yes, and I have no problems with that.",id,,,0
10_36,T,"There are some other things we can do. That's not a breathing tube, but they're a little aggressive. And one is have you ever heard of bipap?",ynq,,,4
10_37,P,I don't think so.,yna,,,5
10_38,T,"It's a mass that really pushes air into you. It's a little uncomfortable, but nothing as bad as a breathing tube. Maybe hard to answer this question, because you don't know what that is. But to have any thoughts on that, if you were really sick if we were to try just a mask, and we would do it just as long as you were okay with it and comfortable at the time,",id,,,0
10_39,P,would it be for a long time?,irq,,,1
10_40,T,"Now, usually, most times with bipap? It's only about two to six hours for most patients.",id,,,0
10_41,P,"Yeah, that would be okay with me. Okay. And if",ack,,,6
10_42,T,"we had to put large IVs and lines into your wrist and stuff, and take you to the intensive care unit. Again, we wouldn't do breathing too, but this is just to watch you closely.",gc,,,3
10_43,P,"Yeah, I would be okay with that. Yes, yes. It doesn't sound invasive to me.",gc,,,3
10_44,T,Okay.,ack,,,6
10_45,P,"No, I just needed to be reassured that that it won't happen again. And and yeah, I'm, I know that on my chart. It's there. Yes, yes. And that's all I need to hear because I was concerned. Okay. ",id,,,0
10_46,T,"I do want to say that this is not set in stone, in the sense that if you ever change your mind, we can have the conversation again. But if we don't hear from you, this is what will go with no breathing to no registered in the heart. I just want you to know that in case anything were to change,",cmd,,,7
10_47,P,"okay. So if I change my mind, I can I will talk to you. ",yna,,,5
10_48,T,Absolutely.,ack,,,6
10_49,P,I don't think I'll change.,gc,,,3
10_50,T,"I don't think you will either. But it's just nice to see that you're aware of that. Okay. Um, honestly, I mean, there's some other questions. I tend to ask people when I don't know them. Well, just kind of routine stuff. Okay. And maybe we'll just quickly go through it go your medical history is the heart failure Anything else?",irq,,,1
10_51,P,"Um, that's it. I'm beginning with an ass but I can't remember what it is.",id,,,0
10_52,T,"Okay, that's okay. We can usually we have it written down. Yeah, your medications. I think I saw you're on aspirin and two jocks and I think two others. Do you happen to know or have them written down?",irq,,,1
10_53,P,You don't want I always carry this paper with me because I can't remember the name. So okay.,id,,,0
10_54,T,"Oh, so you are on the water pill? The furosemide. Okay, ",ynq,,,4
10_55,P,yes.,ack,,,6
10_56,T,"And. Okay, great. Yeah. Um, any allergies? ",ynq,,,4
10_57,P,No.,yna,,,5
10_58,T,"Okay. And I won't ask but anything that runs in your family, given your age, they told me you're 70 Is that correct? ",ynq,,,4
10_59,P,That is correct.,ack,,,6
10_60,T,Yes. And I do have to ask the following Questions completely unrelated to what we're talking about. That's okay. Do you smoke at all?,irq,,,1
10_61,P,"No, I don't ",id,,,0
10_62,T,drink any alcohol.,irq,,,1
10_63,P,"No, no. ",id,,,0
10_64,T,"Okay. And this will be sound crazy, but I have to ask any street drugs, illegal drugs, anything like that?",irq,,,1
10_65,P,"No, I never had the opportunity",id,,,0
10_66,T,to test any over the counter herbals In addition to these.,irq,,,1
10_67,P,"No, I don't take any of those. ",id,,,0
10_68,T,And where are you living right now.,irq,,,1
10_69,P,"I'm living in a convalescent home for the last six months. I used to live in my own home. And six months ago, I'm moved to a convalescent home.",id,,,0
10_70,T,Okay. And how do you feel about that? That changed six months ago.,irq,,,1
10_71,P,"I would really prefer my own home. But just trouble with my breathing sometimes, right?",id,,,0
10_72,T,So you feeling better about being in that place now? A new home,irq,,,1
10_73,P,"It's okay. Okay, I really have to adjust. Like I say, if I had my druthers, I'd go back but I guess I have to learn to adjust to this right. Okay.",id,,,0
10_74,T,So I think I sort of have all the information I need to make sure that your wishes are respected. Just one last time. Anything else you want to talk about today?,ynq,,,4
10_75,P,"Oh, you answered my question. I was so worried about this tube. ",yna,,,5
10_76,T,"Okay. All right. Well, it's very nice to meet you and Stone.",gt,,,2
10_77,P,Thank you.,gt,,,2
100_0,T,"Okay, a great job on your homework was really excellent. He listened to the imaginal exposure recording about six times. And you did the exposure, the in vivo exposure of walking around and touching things like doorknobs and other surfaces and objects you normally wouldn't touch both at your house and other places you went, and you sat down on the floor, and you even ate lunch off the floor at your house and at your mom's house. Okay, and no washing, no wash, no, no hand washing, no extra washing. Perfect. Good for you. Okay, so what did you learn from all that? Do you think over the course of the time you've done that?",id,,,0
100_1,P,It just got easier. At the beginning. It was really hard. And I feel like my stats were much higher than the end. So I guess that was what we talked about the,id,,,0
100_2,T,"habituation, habituation, right? Yeah. The fact that when you do something like that, that initially makes you anxious, and you do it repeatedly, especially in for prolonged periods of time. Your anxiety comes down, right? We're just not built to stay in definitely anxious. Okay. You notice any other changes or anything else?",ynq,,,4
100_3,P,"I noticed that before doing the exposures, I was really, really anxious. And then it kind of went down, like the anticipatory anxiety that we also discussed.",id,,,0
100_4,T,Right. Did that change by so yesterday?,ynq,,,4
100_5,P,Yeah.,yna,,,5
100_6,T,"So you're saying you're not only notice that it went down during the exposure, but you started feeling less anxious even approaching instead? Good? Yeah. Perfect. Okay. All right. Good. Okay. All right. So you're doing so well. We're going to take another step up the hierarchy today like we planned, right. Okay. So this is the dog leash day. You bring it? Yeah. Okay, good. All right. We'll get to that later in the session. First, we're going to do some imaginal exposure. Okay? And you remember what the purpose of that is? Why Why are we going to do imaginal exposure?",irq,,,1
100_7,P,That way I can kind of relive a story or a situation that would make me really anxious and eventually deal with the fear consequence of getting sick in my case,id,,,0
100_8,T,"right. So the idea is, this is how we are able to have you have exposure to or sort of a confrontation in imagination with the consequences you fear of touching things that are contaminated and not washing, doing your rituals. Right. Okay, perfect. So did you write the story? ",irq,,,1
100_9,P,I would say like a 70.,id,,,0
100_10,T,Okay. All right. Go ahead and start when you're ready. Should we press play? Thank you for reminding me to start the recording. So you have that for homework. Okay.,id,,,0
100_11,P,"So I'm in my house and the dog starts barking, and I know that that means that I have to take him out. I really don't want to so I'm thinking maybe I should wait until Joe gets home and he can do it. But I know the dog keeps barking, he's gonna wake up the baby. So I decided to go to the front door and get a leash. I'm not going to wear the gloves they usually wear so I feel we experienced touching the leash. But I'm already feeling really anxious. And I look at the leash and I see that it's gross and full of hair and the dog has been biting on it and in probably has saliva and other things and I see stains and Miss test thinking or if that's dog poop and I get sick and I just feel myself shaking and really sweaty. And my heart is beating really fast. So I'm feeling really, really anxious but I push myself and I grab leash, and I get the dog, open the door, go out and grab the leash.",id,,,0
100_12,T,Okay let me now your stress level,irq,,,1
100_13,P,like 90,id,,,0
100_14,T,"Okay, you're doing great, just keep going.",id,,,0
100_15,P,"So I grab the leash, and the dog is pulling and I feel the lease kind of pushing through my skin and I'm thinking all the bacteria that's getting there and I'm going to get sick, wanna vomit, but I just keep going. So I walk the dog, come back home, and I just leave the leash in the front door. And I'm thinking, I'm probably going to get sick. I really want to wash my hands. I really want to take a shower. But I try not to and I stopped myself. And I'm feeling really, really anxious. So I can't stop thinking about washing. So I tried to go to bed. Decided to fall asleep. The next morning I wake up, and I already feel sick. I know I'm sick. I'm shivering and I'm, I feel like I have a fever and I'm shaking again and I'm really nauseated. So I go to the bathroom, start vomiting. And I know I'm sick. I already got something I should have washed. I started thinking about that. Going to get the baby sick. And I feel really, really sick.",id,,,0
100_16,T,"Okay, great job. What's your level now?",irq,,,1
100_17,P,Like 80. Okay.,id,,,0
100_18,T,"All right. So just keep visualizing this. I'm going to describe it now. And you just stay with that image as much as you can. So you're in the house and the baby's sleeping and you're trying to get some housework done and do things for dinner. Suddenly, you hear the dog at the front door barking and barking and immediately your heart rate kind of jumps up and you get upset and anxious because you know, that means He needs to go out. And Joe is not going to be home for hours. And you really don't want to take him out. But you have to. And it makes you sick and tired and upset, because you're not going to use the gloves that you always use when you have to take them out. So you walk toward the door, and you think, well, maybe I'll just make them wait. But you realize how wake the baby up if you don't take. So you go toward the leash, and it just makes you even more anxious to see it. And it's dirty. And it's chewed up, and it's gross, and you see stains on it. And you think about what those are from and maybe they're from dog poop and that's going to get on you. And you pick it up anyway and snap it on his collar. And as you go out the door and he lunges outside, he pulls that leash into your hand and you feel the contamination from the leash, entering your body, through the pores of your skin and you feel like it's just running up your arm through your bloodstream. And you keep thinking oh my god, what if I get sick from this What if What if there's some germs in this or bacteria, but you keep walking him until he finishes what he has to do and bring him back inside the house. Take the leash off. And the urge to wash is so powerful, so strong, you want to go scrub your hands and get in the shower and wash your whole body and do it quickly and get all these terms off from the leash. But you don't do that. You know, to make yourself not do the ritual. And then you go back in then just keep doing the housework and keep doing things but that's the sense of feeling sick, is staying with you and worrying about what's going to happen if you picked up germs from the leash. At night you go to sleep, still anxious, still upset about what happened. Wake up in the morning. And then before you have your eyes open even a couple minutes you know that you're sick, you can feel your body being sick, you rush to the bathroom and vomit You can feel the fever and the time your body is just not not right. You're sick. And you know, it's because you handled that lesion didn't wash, you didn't do the washing you needed to do. And now you're sick and the baby will probably get sick. And if only you had done the washing, okay? What's your level now?",id,,,0
100_19,P,Like 80,id,,,0
100_20,T,"Okay. Okay, you take it back and you do it again. Okay. Good job.",id,,,0
100_21,P,"Okay, so, I'm home. The dog starts barking",id,,,0
101_0,T,So I understand that you've come in because you're having a little difficulty in your relationship about that.,irq,,,1
101_1,P,"So, basically, it's been getting a little bit worse since we got married. We got married about a year and a half ago. And, you know, the the woman that I married, I thought we were both kind of independent people. And I thought that we would kind of go our separate ways or thing like we used to college, but it's kind of gotten to the point now where it's like, I just want my own personal space and I I don't want to be left alone sometimes.",id,,,0
101_2,T,"Alright, so you're looking for independence in your relationship. Now, how long have you been together? About a year?",irq,,,1
101_3,P,"total four or five years, married for a year and a half.",id,,,0
101_4,T,"And when Franklin Did you notice that? What you kind of think it was the problem like the independence, lack of independence? ",irq,,,1
101_5,P,"I guess kind of once we got married after that, it seemed like, you know, we were spending all of our time together, which, you know, at first was great because we're newlyweds, you know, we love spending time together and everything, but I guess probably about, you know, six months to a year after we first got married, it's kind of, you know, progressed to the point where, you know, now it's just kind of becoming like a burden that whatever I do, she's always there with me. We're always spending every waking moment together and sometimes it's just nice to have My own personal space is freedom, you know.",id,,,0
101_6,T,"So you're looking for that freedom. Sarah, this kind of resonate with you?",ynq,,,4
101_7,T,Can you can you tell him that?,ynq,,,4
101_8,T,"So Frank, what's it like to hear that?",irq,,,1
101_9,P,"It kind of Reminds me of how it used to be, you know, like, she said, we've been dating for four or five years and, you know, back then it It wasn't a problem, you know, she could go out and do her own thing I could go out and do my own thing to not have to worry about each other but now that we're spending every moment together, you know, it's just I'm always worried about her she's always worried about me and you know, when when I do get the chance to go you know, hang out with some friends or something like that. It always feels like, you know, I've pressure on me because I should be with her. She shouldn't be there with me, you know, and I feel like I'm doing the wrong thing by trying to be independent try to go do things by myself. I feel guilty. I do.",id,,,0
101_10,T,"So, Sarah, Do you sense that and, frankly, feels guilty about that?",ynq,,,4
101_11,T,You feel rejected.,id,,,0
101_12,P,"this a little bit after. So, like I said, probably the first six months to a year it was it was really good. But then, you know, reselling is kind of a burden. You know, just always spending time together and trying to make amends and try not to get into fights because we're always spending so much time together.",id,,,0
101_13,T,"So you mentioned that the six months to a year has been the same for you like was the beginning of the marriage, something different to what you have that",irq,,,1
101_14,T,So for you a couple months after that initial phase. So around the same time you started experiencing this difficulty in the marriage,id,,,0
101_15,T,"Okay, are you okay with some space?",ynq,,,4
101_16,P,You don't seem real certain.,id,,,0
101_17,T,"So maybe this, this idea of space isn't really something you feel will work for you.",irq,,,1
101_18,T,Do want to try to address Frank's concerns about the space?,ynq,,,4
101_19,T,You seem apprehensive about it.,id,,,0
101_20,T,"So maybe just experiment with it, try it for one night and see what happens. So, in the year and a half, you've been married, Is there ever been a night when you've gone out by yourself?",ynq,,,4
101_21,P,"Yeah, it's been a couple, especially earlier on, which is nice, you know, just, you know, getting to see old friends and you know, our old college friends, like, of course, we attended, you know, events together and like seeing old friends and everything like that, but there's been, there's been a few times, you know, not, not more than I can count on both my hands, but there's been a few times where I've, you know, gone out and just had, like, you know, a guy's night or something.",id,,,0
101_22,T,"Okay, and what would happened, like in terms of like between you, so,",irq,,,1
101_23,P,"just getting out of the house is basically the hardest part. You know, just finding a way to ensure That, you know, it'll be okay. I'm going to be back home later on in the night that she doesn't need to worry about me, you know, if I have any trouble or anything pops up that I need her help, I'll let her know. And, you know, just knowing that I love her and telling her that I love her and making sure that she knows that I'll be back. But you know, sometimes it's hard because she just gets upset when I tell her that I'm leaving and she doesn't want me to go and she would rather me stay or even take her with me. And you know, I don't want to be the only guy that shows up with my wife. You know, everybody else left their wives at home also. So I don't want to be the odd man out",id,,,0
101_24,T,"all right, so this is really an experiment that's already been tried.",irq,,,1
