ID,Type,Utterance,Dialog_Act,Dialog_Act_1,Emotion,Dialog_Act_Label
115_14,T," Do you think that sounds okay? Yep. All right. So now that we've discussed that issue, yeah. Let's talk about why you've come in to talk to me today. ",id,,,0
115_15,P,Okay.,ack,,,6
116_0,T,"Hi, Heidi, my name is Dr. Sarah. I'm one of the emergency doctors. I'd like to have a chat with you about what's been going On how you've been feeling so we can find out how best to help you. Would that be alright? ",ynq,,,4
116_1,P,"Yeah, ",yna,,,5
116_2,T,"thanks. So everything we talk about will be confidential unless I think that you're at risk of being seriously harmed or someone else's, or they are being seriously harmed. In that case, I'd need to tell someone so we could make sure that person is safe. Is that okay?",ynq,,,4
116_3,P,"Yeah, that's okay.",yna,,,5
116_4,T,"So, it seems like your mom's pretty worried about you. But I'm curious. Are you worried or concerned about anything at the moment?",ynq,,,4
116_5,P,"No, everything's fine.",yna,,,5
116_6,T,Yeah. How's your mood been recently?,irq,,,1
116_7,P,Crap.,yna,,-1,5
116_8,T,Why?,irq,,,1
116_9,P,"just crap. Just don't care about anything, don't want to do anything.",id,,-1,0
116_10,T,So how have you been spending your time filling up your days?,irq,,,1
116_11,P,"just lying in bed all day, doing nothing. Just thinking, I've got these, these thoughts. ",id,,,0
116_12,T,What thoughts?,irq,,,1
116_13,P,Any thoughts of dying,id,,-1,0
116_14,T,You think about that?,irq,,,1
116_15,P,"All the time, every day.",id,,,0
116_16,T,Do you think about how that could happen?,ynq,,,4
116_17,P,I think I'll probably jump over a bridge.,id,,-1,0
116_18,T,Which one?,irq,,,1
116_19,P,there's a really high bridge near my house the swing bridge. It's it's really high so I know I'll die if I jump off. There's also a train track underneath. So if the fall doesn't kill me then the train will,id,,,0
116_20,T,Have you made any plans about actually going in?,irq,,,1
116_21,P,"I'm thinking, thinking all the time",id,,,0
116_22,T,what stopped you from going there?,irq,,,1
116_23,P,"My mom, she'd probably be really upset if I did it but things have just gotten worse and I can't take it anymore.",id,,,0
116_24,T,Do you think about how you could get to the bridge? Um,ynq,,,4
116_25,P,"I've been looking at bus timetables today. The bus that goes by the bridge. Yeah, I think I'm gonna do it tonight. Just can't take it anymore. She can't treat me this way.",id,,,0
116_26,P,Like what?,irq,,,1
116_27,T," I know sometimes when people have a feeling crap and struggling with stuff like you are, they can do other things to hurt themselves, like burning or cutting.",id,,,0
116_28,P,"Yeah, I cut up my links. ",id,,,0
116_29,T,When was that?,irq,,,1
116_30,P,Today yesterday every day.,id,,,0
116_31,T,Have you ever done anything else to hurt yourself?,ynq,,,4
116_32,P,"No, just cutting",yna,,,5
116_33,T,it to the have thoughts about harming anyone else?,irq,,,1
116_34,P,No and never have anyone else.,id,,,0
116_35,P,"No, I don't think so.",yna,,,5
116_36,T,"Assess for disturbances in perception that can be auditory or visual. It's also important to assess the level of protection and supervision that the family offers. caregivers are able to provide for the young person and what other protective factors there are,",id,,,0
116_37,P,Just mum and jack is my younger brother.,id,,,0
116_38,T,How are things at home?,irq,,,1
116_39,P,Not good. Your mum mums always having a go at me. And today we had a massive fight,yna,,-1,5
116_40,T,Do you have someone you can talk to about what's been going on how you've been feeling about these thoughts about wanting to die?,ynq,,,4
116_41,P,"I talked to Sophie, she's she's my friend. She wants to die too, so. I know she won't tell anyone.",id,,,0
116_42,T,Have you had anything alcoholic to drink today?,ynq,,,4
116_43,P,No.,yna,,,5
116_44,T,What about other drugs slot? pot I six to see other people's prescription drugs.,ynq,,,4
116_45,P,No,yna,,,5
116_46,T,"Any questions for me? Thank you so much for talking to me today. I appreciate it. I'm worried about some of the things you've told me and I'm especially worried that you might be at risk of hurting yourself. So I'd like to ask one of my specialist colleagues, john to come and have a chat with you. He's a mental health nurse. So he specializes in talking to young people who've been struggling with their mood or at risk of hurting themselves. Would that be okay?",ynq,,,4
116_47,P,That's okay.,ack,,,6
116_48,T,"It is normally about half an hour, but it can take a little bit longer. Can I get you something to drink while you wait?",irq,,,1
116_49,P,"Yeah, that's fine. Can I have a coke?",yna,,,5
117_0,T,"Jasmine Hi, my name is Heidi I'm your counselor today. We're going to meet in a room to our left something a bit more private in this area and here.",gt,,,2
117_1,P,"Yeah, let's go. ",ack,,,6
117_2,T,So we're just going to go up the hole and to the right and then there's a room on the left. Should I go first?,ynq,,,4
117_3,P,Okay.,yna,,,5
117_4,T,"Come in Jasmine. This is the room. That will be Meeting in today and if you come back again, we'll be in this room again. What I want you to do first is perhaps have a look around and choose where you would like to sit. where you'd like to be. Just the big chair over there. Yeah, so when you're ready, just make your way over to the chair. And I'll close the door. And from where you're sitting now, where do you think you'd like me to be in the room?",id,,,0
117_5,P,"Which chair would you like me to sit in? That's, that's okay. ",gc,,,3
117_6,T,"Okay. So what invite you year to look around, look around the room. Take in this new space. You've never been here before. See if there's something your eyes want to rest on or if there's anything pleasant to your eyes ever really good sticky baked around the room. Most people most time to come into new environments. We want to have a good sticky bacon. We don't and you can in here. Now imagine it's pretty tough for you to be here. Yeah. Yeah. What would help you to spend a moment here?",ynq,,,4
117_7,P,Yeah.,yna,,,5
117_8,T,What's it like to have that pillow against your tummy?,irq,,,1
117_9,P,Its Nice,id,,,0
117_10,T,Yeah. What's it like to have your hands holding tight? They're like that.,irq,,,1
117_11,P,Yeah.,yna,,,5
117_12,T,How did you how did you get here?,irq,,,1
117_13,P,My mom dropped me here here.,id,,,0
117_14,T,She's still here.,irq,,,1
117_15,P,"No, she's not here.",id,,,0
117_16,T,Is there an arrangement to pick you up?,ynq,,,4
117_17,P," Yeah, yeah.",yna,,,5
117_18,T," Man, you're looking at the time. So what time did you arrange for mom to pick you up?",irq,,,1
117_19,P," I'm like, half an hour ",id,,,0
117_20,T,"In half an hour. So notice you're looking around a little bit more now. helps a bit more with that pillow doesn't it? That was a good idea for you to put the pillow there. So how long do you think you'd like to be here? If you had a choice of how long you were going to be here with me in this conversation, how long would it be? ",irq,,,1
117_21,P,"15 minutes, maybe another 15 minutes. ",id,,,0
117_22,T,"Okay, maybe, maybe",ack,,,6
117_23,P,"Yeah, I feel better. ",id,,1,0
117_24,T,Feel better. Yeah. You can just call mom and tell her that the first session is shorter. Yeah. Because it's enough hearts really confronting to be here. A lot of people find it confronting to come here because of the name of the agency. The issues that we may talk about in the future. It's pretty good. confronting. So just getting used to being here is a pretty big deal. And you're doing a great job. You're doing really well. Yeah. And I'm here with you,id,,,0
118_0,P,Such as the police interview that,gc,,,3
118_1,T,"Yeah, it's hard ",ack,,,6
118_2,P,like to go into so much detail. Yeah.,id,,,0
118_3,T,"just just just come back to me just come back to the room a little bit. Can you just look up, look up, look up at me. We'll call out I still have can check it out.",id,,,0
118_4,P,"Brown,",gc,,,3
118_5,T,"good events trying to get you back back into the room with me. Okay, so just look around the Can you see me this painting that's up here? What do you say to me other paintings? ",irq,,,1
118_6,P,"Oh, yeah. Yeah, cool. Okay. ",ack,,,6
118_7,T,"I just want you to catch this for me so we can throw it back to me. Okay, this fell back to me I see that's a good good start back to me. Good Practice saving stay here and stay here in the room with me here. Yeah. And also get your character on that's it. Okay, so just just want you to just to keep in the room with me a bit and sometimes it's a bit bit stressful and overwhelming. Okay, but we're still connected. Okay, you're back there. Okay. How you feeling? Yeah,",irq,,,1
118_8,P,"okay. Yeah, really, it was really hard. Talk about that stuff.",id,,-1,0
118_9,T,"completely understand why things are really, really tough moment. And that sort of conversations with a place in town could be very stressful for you. Yeah. I get Yeah. So maybe a feeling now, where you are? Yeah. Okay, so maybe just want to keep talking. Just remember that we're connected. Okay. And you're here with me. Yeah. Yeah. So tell me a little bit more. So your mom came to, to the to the statement?",irq,,,1
118_10,P,"Oh, yes. So um, so mom was with me. Yeah. They came over. And they were two detectives. Yeah. And they, yeah, they just wanted to know everything and it took like hours.",id,,,0
118_11,T,And how are you feeling now after you've done it all?,irq,,,1
118_12,P,"Like, I'm glad it's over and done with. I didn't realize how hard it would be to talk about it. Yeah, yeah. For some reason I was thinking it was. It was all over and done with no. Yeah. Okay, now",id,,,0
118_13,T,"it was really understandable. It's completely, you know, understandable that sometimes it's difficult to talk. And sometimes you can afford back to tough times. Yeah. So we just keep talking. I would keep talking like this",id,,,0
119_0,T,"Hello, Sophia.  ",gt,,,2
119_1,P,Hi. How are you doing today?,gt,,,2
119_2,T,I'm good. How are you?,gt,,,2
119_3,P,I'm doing well. Thanks for asking.,gt,,,2
119_4,T,"I saw you last time a week ago. And I know you've had some concerns with employment working on employment. The first before we get into that I wanted to check in and see how you're doing emotionally. I know from last week, on a scale of one to 10 you said you were suffering from depression at about seven. Yeah. How is it today?",id,,,0
119_5,P,"It's been it's been up and down. I think today, it's probably a seven again. But you know, I've been back down to a nine lately. I guess maybe I feel a little better because I'm coming here. And I know, we'll get to talk about it a little bit. But I guess you know, last time we were talking about me trying to get a job and live full time job. And I think I just realized last week that it's really hard for me to work full time right now. You know, I'm doing the part time thing with the work program, and they want us to do volunteer work in the afternoon, if we haven't found a full time job by a certain week. And I just, you know, just thinking about it, and I just don't think I can do that. I just don't think I can work for eight hours every day. It's just too much.",id,,-2,0
119_6,T,"So you're having some concerns about full time work and that level of energy, you'd have to exert that commitment. Alright, so we'll be okay today, if we kind of structured, what we're going to do sure for for this session. So, if it's okay with you, I'd like to talk about that. Okay. All right and and get some more details about kind of what's going on this week and your feelings surrounding that. And we touched on this a little bit in the last session. But I'd like to talk about kind of your core beliefs, your central beliefs that might be contributing some of these feelings of depression. Yeah. And then, for the last part, we'll work on like we did before, interventions to try to help you with with what's going on at work and with your depressed mood. And we can make changes to this as needed. I just want to start with an outline that we can, we can have going in okay. So make sense. Okay. Anything you want to add or take away from that?",id,,,0
119_7,P,"No, I mean, that makes sense.",yna,,,5
119_8,T,"Okay. So, tell me a little bit more about what's going on with the work.",irq,,,1
119_9,P,"Well, I mean, I don't really know why it is. I know I'm always tired because I just I have so much trouble sleeping, as I told you before. It's just It doesn't matter how tired I am, I can't sleep, but it's just I go, I go in the morning, you know, eight to noon, but then in the afternoon, it's just like, it's so hard to keep going on. It's just such a long amount of time. And I just feel like, I don't know if I can really do it. And especially in the winter, you know, if you work eight hours, by the time you get out of work, it's dark out and it just makes my depression so much worse.",id,,-2,0
119_10,T,"So, the latter part of the day is more of a struggle for you.",irq,,,1
119_11,P,"
 Yeah, a lot of hard work day.",id,,-1,0
119_12,T,So getting up in the morning and getting to work on time. You do okay with that.,irq,,,1
119_13,P,"It's hard. It's hard, but I feel like I'm better at that. I'm better at it. I'm already up anyway. So, you know, I know I gotta get up. I gotta do what I have to do.",id,,-1,0
119_14,T,"So the work program you're in now, you work in the morning?",ynq,,,4
119_15,P,Yeah.,yna,,,5
119_16,T,What hours are you there?,irq,,,1
119_17,P,Eight to noon.,id,,,0
119_18,T,And there's some work you have to do in the afternoon.,irq,,,1
119_19,P,"Well, yeah, since I've been there for what is it eight weeks. And I haven't found a job yet. They want us to volunteer in the afternoon and they find us our own place of volunteer. So that's good. I don't have to find that myself. But I guess they want to get you used to doing something for eight hours a day and maybe you have something to put on your resume. And guess what? have like a big gap in your resume that doesn't look good either. So haven't been able to say a work tear even though I didn't make money. But just thinking about it, it's so exhausting. And you know, I get out of the work program and I think if I did go to, I can barely make it home. It's just so all I want to do is go home.",id,,-1,0
119_20,T,Thinking about it's exhausting. Can you tell me what type of thoughts you're having?,id,,,0
119_21,P,"I just don't think I can do it. Like, I just don't think I'm the kind of person that can work eight hours a day. And it just makes me feel like what's the point like, I'm going to work eight hours a day.",id,,-1,0
119_22,T,I don't think I can just there's just too many hours.,id,,,0
119_23,P,Yeah.,yna,,,5
12_0,T,"So, can you think of another case you're working on another family different than the one that we've initially talked about? Where you've made a decision that seemed like was fairly clear caught like one you would have made before and yet you're, you're thinking about it replaying it?",irq,,,1
12_1,P,"Yeah, I have this case. You know recently where it's a single dad, the mom passed away and I go in and check on him and his son, you You know, things are going well, but, you know, I think the dad has a hard time so it's not like it was before when the mom was there. Not that I wasn't there before that but you can just tell that like, things are a little different. But you know, obviously, my decision is that things are going well for the kid, you know, they're gonna he's gonna stay there. Dad is stable, but I just worried like, is the dad under too much stress? Is he really taking care of the kid as good as you know, what if he's just cleaning up the house and doing the right things on there while I'm not there? You know, does he have the energy to take care of his kid? Or is everything really the way I it appears? Or is there more going on? I just don't know.",id,,-2,0
12_2,T,Right. So you're handling it to the best of your ability. But there's still these these thoughts that are coming out. Kind of encouraging you to second guess your judgment?,ack,,,6
12_3,P,"Yeah. And it's like, I can't let it go. Like, I saw him like two weeks ago. And I still wonder if I have other cases like that. It's like, they're all running through my head. And I have these thoughts like, Did I do the right thing? Can I do the right thing?",id,,-2,0
12_4,T,"Maybe what if, what if the worst happens?",irq,,,1
12_5,P,"And I didn't see it. Like, what if something terrible happens? And I should have known better.",id,,-2,0
12_6,T,"So it speaks back to your competency as a professional again. So that's, that seems to be court this. I think Here are several things you talk about seem to connect back to. Are you capable to be in this field? And should you be trusted?",id,,,0
12_7,P,"Yeah, definitely.",yna,,,5
12_8,T,"So coming back to thinking there are errors and thinking that all people make. And when these errors become repetitive and you can kind of see them applied in more than one areas of his life. We refer to that as a cognitive distortion. Okay? It's not bad or good. It's just how people think. It's just patterns that people fall into. And there are several different cognitive distortions, there's several patterns that we kind of see. come up often in this work, right as a counselor, wondering, in the situation where you're thinking, the worst possible outcome is unbearable, or likely or both. If you may be really focusing and emphasizing on that, to the exclusion of other evidence that suggests you've made a good decision. I see you're really focused on the negative outcome, the worst possible and maybe even unlikely outcome. And maybe not weighing all the evidence with the same weight, like you're putting more weight on the negative pay, that kind of makes sense.",id,,,0
12_9,P,"Yeah. I mean, I think that that's probably true. Because before I felt fine, and now I just feel like everything's falling apart and not that much has changed. And so it kind of makes me think that that's probably what's going on, but I don't know how to change that.",id,,,0
12_10,T,This is frustrating for you. Yeah. The self doubt is worrying.,id,,,0
122_0,T,"Hello, Mr. Taylor. My name is Dr. vinita. And I'm one of the psychiatrists who works here right. Okay, can you tell me what's brought you here today?",gt,,0,2
122_1,P,"Yeah, well, I was referred to by my GP, right. They referred me to you because. Well, my wife thinks I'm drinking too much.",id,,0,0
122_2,T,"I see, do you think you're drinking too much?",irq,,0,1
122_3,P,"Well, I",gc,,0,3
122_4,T,Right? Maybe we can just explore that a little bit more. Yeah. How much would you say you drank in a day? Now?,gt,,0,2
122_5,P,"Yeah. Oh, It has crept up over the years. Well, I suppose if I'm, if I'm honest. Yeah, I drink about a bottle of vodka a day",id,,0,0
122_6,T,about bottle of vodka. And how long have you been drinking that much for?,irq,,0,1
122_7,P,"Well, as I say it's crept up on for Few years now,",id,,0,0
122_8,T,"a few years, can you make it a more specific two years? Three years? Five years?",irq,,0,1
122_9,P,"Well, I mean, as I say, it's crept up. I mean, initially, I just used to have a couple of drinks after work, right? Because I got a pretty responsible job. And I just found the drink calmed me down, you know. And then I got more responsibility, and I found a bit more alcohol helped me so. Yeah, yeah. So drinking about it.",id,,-1,0
122_10,T,"Okay, so you'd say of about the last two years three. Okay. And do you drink anything else apart from vodka?",irq,,0,1
122_11,P,"Yeah. After work, I normally go to the pub and have two to four pints of bitter or lager.",id,,0,0
122_12,T,Right. Okay. And would that be every day?,irq,,0,1
122_13,P,"Yeah. Well, especially, you know, Monday to Friday when I'm working. But at weekends, I normally go down the local pub At lunchtime,",id,,0,0
122_14,T,right and how much is a few?,irq,,0,1
122_15,P,"Okay, and about two to four. Right.",id,,0,0
122_16,T," Okay. And then so on a weekday I've got about you take about you have about two to four pints afterwards and then you come home and drink about a bottle of vodka. Yeah, well,",irq,,0,1
122_17,P,"no, well, no, I don't come home and drink a bottle of vodka. I drink a drink during the day. So when you drink drought when I'm working mind, you know when you're working lunchtime, okay, when I'm at work,",irq,,0,1
122_18,T,"when do you start drinking during the day? On an average day,",irq,,0,1
122_19,P,when after I'm up and dressed and have me breakfast.,id,,0,0
122_20,T,"Right. So after breakfast, and again, when did that start?",irq,,0,1
122_21,P," Couple years ago, a couple of years ago. ",id,,0,0
122_22,T,"Okay. And what about the weekends at the same at the weekend? And would you drink you go to the pub at lunchtime at the weekend? Would you drink more than a bottle of vodka during the day or the weekend? No. It'd be about the same. Okay, and then the rest regular time when you drink more than what you tell me. ",ynq,,0,4
122_23,P,No.,yna,,0,5
122_24,T,"Okay, so And is it just beer and vodka? Or do you drink wine?",irq,,0,1
122_25,P,"No, no. We used to drink wine my wife used to when we had an evening meal together. Sometimes we had a bottle of red or a bottle of white together. half a bottle. But since she started complaining that she thought I was, you know, really shoving it down my throat. She sort of nailed on the head. So don't do that anymore.",id,,-1,0
122_26,T,Then would you say you have to drink more to get the same effect from the from the alcohol?,irq,,0,1
122_27,P,"Same common,",id,,0,0
122_28,T,some common effect? Do you have days where you don't drink or periods where you don't drink? When was the last time you had that?,irq,,0,1
122_29,P,"A few months ago now. When she really had a go at me and I thought to myself, well, maybe I'll give it a try. Again. It wasn't the first time but um",id,,-1,0
122_30,T,for how long did that last for,irq,,0,1
122_31,P,about three days,id,,0,0
122_32,T,and it In that time did you experience any? any physical feelings at all?,irq,,0,1
122_33,P,"Dude, I mean, I was shaking. very shaky. I got I was on edge all the time. I was not working properly, and I was sweating. And I just felt absolutely lousy. Yes. take time off work. No, I didn't take time I couldn't do I didn't dare take time off work. I just said I had a bit of a cold, right. But I thought to myself, well, I can't carry on like this. And so I had a couple of largers on the work. And that made that made you feel better on the straight and narrow.",id,,-2,0
122_34,T,Did you ever feel? Do you ever get those similar sorts of feelings in the morning when you wake up?,ynq,,0,4
122_35,P,"Yeah, ",yna,,0,5
122_36,T,"you do. And what happens yet when you have a drink in the morning that makes you feel better? Does, right? Yeah. If you don't have that drink in the morning, what happens",irq,,0,1
122_37,P,"over the time I get to work I just feel. Again, I feel pretty shaky and very on edge. And as I say I don't touch it when I'm at work. Got a pretty responsible job. And I do, as I said, Don't touch it at work,",id,,0,0
122_38,T,and you work as a bank manager.,irq,,0,1
122_39,P,I do,yna,,0,5
122_40,T," Okay. Has anyone has anyone commented apart from your wife about your drinking? Have you ever had any more serious health problems from your drinking? Have you ever seen a doctor or had sometimes people get loss of memory or Fitz Shams? Very serious shakes, they need to go into hospital.",irq,,0,1
122_41,P,He does some blood tests.,id,,0,0
122_42,T,And did that show anything?,irq,,0,1
122_43,P,It wasn't too good.,id,,-1,0
122_44,T,Right?,irq,,0,1
122_45,P," And then I because of my you know, my wife friend to leave me basically. That's what got me to see the GP. Oh, he did some blood tests. And he said your liver, you know, told me I've got to cut it down a bit. What did he say about a room and he said he was going to refer me to somebody to talk about it.",id,,0,0
122_46,T,Right. Okay. And how did you feel about that?,irq,,0,1
122_47,P,"Well, I wasn't exactly over the moon when he suggested it. But um Well, I suppose you know if it's a choice of coming to see you, and then or my wife leaving me. I came to see, I don't want to lose her.",id,,-1,0
122_48,T,"So I can see that it's had quite an impact at home. Yeah, well, but outside the home, how's your drinking affected jobs or anything else? My job about relationships other than your wife with family friends? Well, any other serious consequences? Yeah,",ack,,0,6
122_49,P,"I have to go to family dues dragged along there. But I mean, I don't I mean, I avoid mixing with my work colleagues socially. I find that bores me, because if I'm in the pub with them, I've tried it once and I found I needed a drink and you know, I thought, well, I'm going to put my foot in it if I carry on like this. I left early, and I just make excuses. I don't I don't socialize with them anymore.",id,,-1,0
122_50,T,"Okay, thanks for coming to talk to me today.",gt,,0,2
123_0,T,"So How you doing today? I heard you. I'm doing Okay, thanks for asking. What's your name? ",irq,,,1
123_1,P,"Tom, Tom Beckwith ",id,,,0
123_2,T,And which hands you normally write? Right? Right hand would be all right to ask you some questions about your memory.,id,,,0
123_3,P,2017,gc,,,3
123_4,T,What season of the year is this?,irq,,,1
123_5,P,Winter,id,,,0
123_6,T,What is the date today?,irq,,,1
123_7,P,The 16th,id,,,0
123_8,T,what day of the week is this?,irq,,,1
123_9,P,Tuesday?,id,,,0
123_10,T,What month is this?,irq,,,1
123_11,P,January,id,,,0
123_12,T,Can you tell me what country we're in?,ynq,,,4
123_13,P,the United States.,id,,,0
123_14,T,What County are we in?,irq,,,1
123_15,P,Wilmington.,id,,,0
