ID,Type,Utterance,Dialog_Act,Dialog_Act_1,Emotion,Dialog_Act_Label
101_25,P,"tried twice. Yeah,",id,,,0
101_26,T,"yeah. Just Just a few times. Is there any reason to believe that if you try it next week, it'll be different?",irq,,,1
101_27,P,That's not good.,id,,,0
101_28,T,Don't you don't think so.,irq,,,1
101_29,P,"Well yeah. mean, we've been doing it, you know, the past couple months, but it seems like every time we do is you know the same result it's her getting worried about me and you know me trying to find a way to assure her that it's gonna be okay and you know that we're so married we're still in love, you know everything like that, but, you know, it's just, I really want my space and it seems like sometimes I just can't get out of her crib.",id,,,0
101_30,T,"Sir, what do you think about that?",irq,,,1
101_31,T,"All right. So in terms of the going out, although going out with your friends wouldn't have to be on the weekend that something could happen during the week.",id,,,0
101_32,P,"Yeah, absolutely. You know, a lot of my friends normally go out during the week because you know, they have their families and everything to take care of on the weekend. So, yeah, I could definitely go out tonight during the week.",id,,,0
101_33,T,"Okay, so you could agree. The both of you could agree to that as kind of terms of this behavioral experiment or weekends, you'll spend those weekends together.",id,,,0
101_34,P,I think we could try that.,ack,,,6
101_35,T,"Because that was a concern you specifically brought up. How about Sarah, how about the times during the week? How do you feel about those?",irq,,,1
101_36,T,You feel like you'd respond better to that? Would that be a better experience?,ynq,,,4
101_37,T,Something that you think that you could try next week.,id,,,0
101_38,T,"So, let's talk about when because you've gone out before and you said it was just getting out. Getting out the house that was the, the real challenge right? So walk me through. This really goes through both of you. What we through what happens when you're when you're getting ready to leave when you're planning to head out?",irq,,,1
101_39,P,"So you know, usually I'll go get dressed I'll let her know where I'm going you know, give her my cell phone number you know somebody else's phone number in case my phone is off. Just basically tell her what we're going to do you know whether we're going out to to a pole or you know, going to watch some sporting event or something like that. No, I would tell her what we're doing, you know, just so she knows and knows where she can find me. But then after that, it seems like as soon as I assure her of what we're doing, and when it's happening, when I'll be home, everything like that, it just seems like all the progress I made towards the front door kind of gets pulled back a little bit because like, she doesn't want me to leave, you know, I can see in her eyes that she's not very happy about me leaving her. And that kind of makes me feel guilty, you know, because I don't want to leave her alone. I want her to be more independent. I kind of want her to, you know, if I'm going out, I would like her to go out as well. You know, she says tons of friends. You know, we both have friends. We both have our social circles. And she's kind of it's frustrating when I can't go do my thing, because she's always got to be with me.",id,,,0
101_40,T,"So ultimately, after all that you you do go, but you feel feel guilty. And do you have a good time?",ynq,,,4
101_41,P,"Most of the time, right? Do you know, sometimes I just can't get over the fact that you know, my wife at home who's upset at me, and that makes me upset. You know, it's just a matter of finding the balance between, you know, my independence and her, you know, doing her own thing because I would like her to do that as well.",id,,,0
101_42,T,So sometimes you have a good time sometimes you don't. You're worried about Sarah being home. How about when you come home?,ynq,,,4
101_43,P,"When I come home, usually things go back to normal. I mean, we've definitely had our exchange of words after a few times me coming back. But most of the time it goes back to normal, which you know, it's fine. We're very loving, affectionate couple. So that's awesome. But you know, most the time it's just overbearing.",id,,,0
101_44,T,"Is that how you see it Sarah, the way Frank described it?",ynq,,,4
101_45,T,so how about one is out? Like so after after he's left? What do you What are you thinking that? Like?,irq,,,1
101_46,T,You're anxious something bad's gonna happen.,id,,,0
101_47,T,"Do you think that there's been any reason for that thinking, like, do you think there's any basis for thinking something bad's gonna happen? ",ynq,,,4
101_48,P,"Absolutely not. No, no, I love Sarah you know, the five years that we've worked together been great, you know, it's it's just where we are now as opposed to where we first were, and when we first got married, it's it's changed and you know, I would just like some independence just like to be on my own sometimes. And I guess I don't always relay that well to her and she doesn't understand why I want my space. I want to go hang out with my friends, but I've been trying to explain to her that, you know, it's, it's a two way street. It's not just all one way and so we have to work on these issues. And you know, that's why we came to you.",yna,,,5
101_49,T,"Alright, so you're really frustrated by not being able to go out, go out. But you're anxious about when he goes out. So we talked about the possibility of like an experiment or you go out sounds like we might run to the same difficulties you experienced before. What can we change to increase the chances of that experiment working?",irq,,,1
101_50,T,"So, so if you called when he was at Piedmont The answer is that's something that's normally possible.",id,,,0
101_51,P,"Yeah. Yeah. Most of the time, I'm very good at responding to, you know, making sure that she knows I'm okay. Making sure that she's okay.",id,,,0
101_52,T,"So that's a compromise, you'd be willing to make. Absolutely something like that. ",ynq,,,4
101_53,P,Yeah.,yna,,,5
101_54,T,"You need any other reassurances from Frank, Sarah?",irq,,,1
101_55,T,Do you have a plan to call Frank? Like when he's out? Or is it something that you would do if you just felt the need to or,irq,,,1
101_56,T,Were you calling for some specific reason?,irq,,,1
101_57,T,"Why don't you start reinsurance? Everything's going right. Okay, so that seems reasonable to you. Right? I mean, I, I guess",irq,,,1
101_58,P,"but at the same time, like when I'm out doing my own thing, you know, I kind of want that privacy in that, you know, just being in the moment you know, because I know when I get back home, from back with you and I'm, nothing's changed because I've always been with you like we're still married. But when I'm out with my friends, and you know, I'm getting a couple phone calls during you know, the night over the course of the night and it's having to deal with my wife and having to make sure that she knows I'm okay and everything like that it it gets a little frustrating. It's a little, I mean, frustrating",id,,,0
101_59,T,"Would that be a good compromise? It was a text or two. I guess. That's better than a phone call, right? Yeah. So not ideal, but you can see how it might decrease your anxiety a bit. Right? And maybe work toward a little bit more freedom. So that's how I can experiment you both combined to try.",ynq,,,4
101_60,P,"Okay, so we could try and try it out.",id,,,0
101_61,T,"Alright. So it's not a perfect plan. But it's one that you know, I would hope that we could be successful with if you could, though, you're going through it, maybe track what happens, right, from your own perspective, like what you were thinking, the fact left, what you were thinking when you left, how it went, how that separation kind of was conducted. And what happened. Same thing when, while you're out how many times you texted her If you called and then what happened when he got back? Right? That's just kind of, and you can you can keep a record of those things just independently. You know, you write it down Come your experience and you write down your experience. And we'll come back next time. No matter what happens with it, we'll compare and kind of see what see what happened and how we could make adjustments to to make it work even better.",id,,,0
102_0,T,"Now, one thing I thought we might do today is to get an example of one of these situations in which you get really anxious. And try to see if we can understand more about how you think and how you feel when you're in the middle of one of those situations. So can you think of an example of something that's happened recently? ",irq,,,1
102_1,P,"My daughter has been, she's actually been sick. And so she had a fever yesterday and they started her on an antibiotic and I had to go pick it up from the drugstore, and that's like, I don't usually go there. It's hard to get there. Like it's not right in the neighborhood. So any expressways or bridges to get there, not expressways, but It's busy, it's busier and attracting a mall. So you know, there are six lanes four lanes. Yeah. So it just, it's not someplace I usually would go. And if I was going to go, usually I would either have her go with me or my husband go with me, but she was sick and he was at work. And",id,,,0
102_2,T,"so to try to understand what goes through your mind that's trying to take you back. And now you know that the prescriptions there and your daughter's sick and I guess you don't want to ask her to drive over there. I sorted Yeah, probably not the wisest idea. So you're thinking about doing the drive and what's going through your mind? What are the thoughts that are turning inside?",irq,,,1
102_3,P,"I'm just, you know, I'm sort of thinking about going there. And I'm already starting to think well, you know, what, what if you know what if, what if I'm driving and somebody crashes into me What if I'm driving and I can't do it? You know, what if I just have to stop because I can't do it anymore and, you know, it was raining and I'm sort of like, I've got this picture of myself like out in the middle of the road and you know, what's the picture look like? You're out in the middle of the road and stranded and it's dark and my you know, you know, my shoes are gone. I'm just like, it's like I it would be a million miles to get back home. pretty miserable.",id,,,0
102_4,T,Yeah. Yeah. Pretty scary.,ack,,,6
102_5,P,"Oh, terrifying. Yeah. And I just it's so hard to get there.",id,,-2,0
102_6,T,And Kate as you as you put yourself back into that situation and have those thoughts going through your mind. What kinds of feelings go along with it?,irq,,,1
102_7,P,"My feelings I mean it things are inside like ago anxiety, physical things are going on. Well fear and anxiety and I just feel really shaky and I feel really like lightheaded and dizzy and I just don't feel like I can breathe very well and",id,,,0
102_8,T,It's just a panic attack now? He told me about having some bad ones.,id,,,0
102_9,P,but it's getting there not quite to a panic.,id,,,0
102_10,T,"Yeah, no, it's brewing.",gc,,,3
102_11,P,"Yeah. Okay. Yeah, it feels like it might. Yeah,",gc,,,3
102_12,T,"yeah. What do you think we might do to try to, to move things along toward getting a plan of attack on this, okay, is to actually sketch this out. Okay, and, and then see if we can figure out some things we might be able to start doing to give you a better handle on that you have right now. Okay. So let's put some boxes here. And one of them is going to be event these are the things that trigger your anxiety. In this case, the event was",irq,,,1
102_13,P,"the driver having to drive to the, to the pharmacy,",id,,,0
102_14,T,"drive to pharmacy. And then this next box, I'm gonna label something we call automatic thoughts. And but automatic, I mean that they occur relatively automatically, they just sort of pop into your mind, and you don't stop to check them out. Okay, and we all have these kinds of automatic thoughts. You don't have them, everybody I know has them their inner thoughts. In fact, if you think about it for a minute, we probably have a lot more thoughts. We don't speak out loud, that are part of our inner dialogue and thoughts, we actually end up speaking aloud other people. Mm hmm. And I suspect that you have lots of those thoughts and just give me some examples of them. So that's what we call an automatic.",id,,,0
102_15,P,So the like the what ifs?,irq,,,1
102_16,T,"Yeah, so let's put a couple of those down in this box. Okay, in the automatic slot box, and they are what if",id,,,0
102_17,P,someone runs into me.,id,,,0
102_18,T,Yeah. What if What else?,irq,,,1
102_19,P,What if I get stranded?,gc,,,3
102_20,T,get stranded.,gc,,,3
102_21,P,I can't do it.,yna,,,5
102_22,T,I can't do it. And then there was this image about the rainstorm and you don't have any shoes on. Yeah. so forth. What should we put down for that?,irq,,,1
102_23,P,I think what if I would if I can't get back home? I can't get back on.,id,,,0
102_24,T,sort of lost. Yeah.,ack,,,6
102_25,P,Yeah. What if I end up on this road forever?,irq,,,1
102_26,T,"Mm hmm. And then we're going to put another box there's a sort of a chain of events here. The event can make you think in ways that stir up feelings of anxiety. And so if you're thinking like this, it makes sense that you'd be feeling pretty nervous inside and you might have some of these physical reactions. Mm hmm. So let's put those in here. This is the emotion sparks They are much shaky. You said? Yeah. Quite a fear. Yeah. If we're going to write that fear on a zero to 100, scale and zeros, none at all and 100 is the maximum anyone could ever get. Where would you be at this point?",ack,,,6
102_27,P,"Oh, I'd say about an AD",id,,,0
102_28,T,"AD pretty high. Yeah. It's gotten higher though, I suspect. Oh, yeah. This point is in 18. Okay. And then you had some other feelings inside?",id,,,0
102_29,P,"Well, I yeah. I sort of felt like I might fall over. I, my heart was pounding and I didn't feel like I can",id,,-2,0
102_30,T,"breathe. Stomach any lobster. So yeah. So a lot going on here. Yeah. And a pretty high level of distress. Yes, right. And then we're going to complete this loop. Putting a box we're gonna call behavior. This is how you actually acted when you're in the situation. So what did you do? If you had these thoughts and you had these feelings,",id,,,0
102_31,P,I went to the pharmacy. He did do it. I had to okay.,gc,,,3
102_32,T,And what was it like for you when you were going to the pharmacy and driving there?,irq,,,1
102_33,P,"It was so bad. I just, you know, I, I think I left permanent marks on the steering wheel, because I was whole time.",id,,-1,0
102_34,T,"Okay, yeah. So in this case, she actually did go to the pharmacy. That year, maybe it isn't damage to the steering wheels. Yeah. Yeah, I hope not.",id,,,0
102_35,P,"But I really had no choice. I mean, I think usually I wouldn't go to the pharmacy. Usually. I would call my husband and say can you pick it up on your way home, get",id,,,0
102_36,T,"an escape route, if you would?  So usually you would avoid this if we looked at this as a model. For many of these situations about driving and feeling, yes, the usual behavior would be to try to get out of it or avoid it. Okay? And so if you do avoid it, then what happens?",irq,,,1
102_37,P,"Well, I feel better. You feel better. It's like such a relief.",id,,1,0
102_38,T,"Better relief, the emotions calm down now, right?",irq,,,1
102_39,P,"Well, yeah, cuz I don't have to, like,",id,,,0
102_40,T,"You don't have to worry about it. So that's what happens for a single episode of this anxiety. I'm wondering though, if we look at the the impact on you of avoiding and getting relief, overall, as far as managing driving, what do you think it does there?",id,,,0
102_41,P,"Well, I feel like I don't really have much confidence when it comes to this to be able to do",id,,-1,0
102_42,T,"it. Okay. So in a way, it decreases your confidence over time. I think so. Yeah. I think suspect that that not doing it repeatedly gives you this belief about your capacity to do these driving things. And what's that belief? Yeah,",irq,,,1
102_43,P,I don't feel like I can do I can't I can't do it.,id,,-1,0
102_44,T,"I can't do it. So it really comes back to this thought I can't do it. Yeah. And he can't do it. You don't do it. Right. So here's this, this chain of events, events, trigger thoughts. We call them automatic thoughts, and then they influence your emotions. He's feelings you have and then that influences how you handle the situation. Mm hmm. Okay. Now let's think together for a moment before we wrap up of how we might proceed to try to give you some help with this. So let's take a look at these thoughts. Do you know anybody else that drives regularly that might think differently than you? Yeah, okay. I mean, an example.",id,,,0
102_45,P,"I mean, I think almost everybody, I think most people drive without too much. problem but like, my sister loves to drive. Yeah, I mean, she just she drives every opportunity she gets.",id,,,0
102_46,T,"So for some reason, we don't know exactly why. But the key thing here is not looking at why but to help you with actually making change in this. But you do have some differences in the way you think about driving. That might be something that we could begin to work on in our session, we might, for example, check it out, what's the chances of someone slamming into you? Okay, what's the chances of you being stranded out there on highway and even if you were stranded, is there a way you could cope with that or manage that you can get back home? So these are some things that we can begin to do. So I'm going to mark here, we could work on these thoughts, okay. And then by working on the thoughts, we might be able to help you reduce the emotions, but there are also some things that I might be able to teach you that you could use to reduce this level of distress that you have that Would be nice to be able to calm yourself down in situations. So we'll have some, try to build some skills to manage your emotions. And then on this behavior side, one thing that we might begin to work on is helping you gradually begin to take on some of these driving things so that you can build your confidence back up. And again, build your skills to do it. And I can see that that causes a little bit of edginess here, what would you think? ",irq,,,1
102_47,P,"I was thinking that I hope that this doesn't like make me worse. Okay, no, like, trying to do some of these things.",id,,,0
102_48,T,"Well, I'm glad you gave me that feedback. That's an example by the way of me wanting to hear from you about the way you're responding to what I'm saying. I certainly wouldn't want to make it worse. Okay, but it cause you too much anxiety. Uh huh. And what we'll try to do is pace it adjust to the level that's right for you. Okay, so that you can make some progress and get to the place you want to be, which is to be able to drive to your new office, cross a bridge, and maybe even, you know, drive those couple hours to visit your son. Right. Yeah. So what do you think?",id,,,0
102_49,P,"Well, I think that that would if I could do those things that would be really nice. Yeah,",id,,,0
102_50,T,that could be really nice too. So that would be our goal. Yeah.,id,,,0
103_0,T,"between here and there, obviously, if it were easy, you wouldn't need me, you wouldn't have 13 therapists. If this were easy you would have been to a life you wanted a long time ago. So it's obvious that it's easy it already be done. Because it sounds like you're a person with a lot of motivation works really hard, because there are very few people who wouldn't quit before 13 therapists. So that's a very good quality. The very fact that you've gone through all these therapists is a good sign for us. Nonetheless, it is difficult. between here and there, there's going to be hell. Exactly. Right. So I figure our number one priority has to be to get you to stay alive through house so that we can get to the life you want. If that's where we're at. Now. We got to have some sort of agreement, not by writing a contract. Because I'll fire you if you try to kill yourself that because we both sort of have to face the fact that to get there you got to go through there and to go through there you got to stay alive.",id,,,0
103_1,P,Okay what you guarantee that you can get you can call me and I'll guarantee I'll get myself,id,,,0
103_2,T,What are you gonna do if I fail?,irq,,,1
103_3,P,"Beside break Mike. Okay. So if I don't help you, you'll kill yourself. Yeah, okay, but if I do help you Well",id,,,0
104_0,T,Let's talk about then how you ended up cutting yourself,id,,,0
104_1,P,Isn't it obvious?,id,,,0
104_2,T,"So what happened? First of all, tell me what you did. Exactly",irq,,,1
104_3,P,what do you mean what I did?,irq,,,1
104_4,T,"Well, I mean where'd you cut yourself? I know you said you cut yourself with the",id,,,0
104_5,P,same as always same as always,id,,,0
104_6,T,your arm?,irq,,,1
104_7,P,yeah.,yna,,,5
104_8,T,What did you cut yourself with?,irq,,,1
104_9,P,a razor.,id,,,0
104_10,T,Can I have a look?,irq,,,1
104_11,P,you want to see it?,irq,,,1
104_12,T,Yeah,id,,,0
104_13,T,"okay, but part of the problem is those look deep in like you're going to have significant scars. So my suggestion is in the future if you do it is that you put some sort of bandaid on it to keep it closed. But let's talk about how how this happened. First of all, tell me you were telling me on the phone that you wanted to die? But did you? Was this a suicide attempt? Or do you think was just just a cutting we thinking about killing yourself or wanting to kill yourself or wanting to die? ",irq,,,1
104_14,P,I was thinking about killing myself? I thought you would help me and you didn't. That's what I want to talk about. I want to talk about how it is that my life is not going better and you are not helping me and you're not available to me when I need help.,id,,,0
104_15,T,"Okay, so let's Okay, so it sounds like me not being a bit was me not being available with you rate related to cutting yourself",id,,,0
104_16,P,I cut myself the first time I called you thinking you would help me You wouldn't help me. So then I figured what the hell I might as well just go all the way and so that's why I cut myself that deep,id,,,0
105_0,T,"Robert Smith, thank you for coming to see me say,I,m Dr. Stanley. I'm one of the doctors that works here. Obviously anything that we say is confidential between us and the team that I work with a new GP who's asked me to see you. I hear there have been some problems with your housing. Do you want to tell me a little bit about it?",irq,,,1
105_1,P,"Yeah, I've had all sorts of problems. I mean,where do you want me to start? neighbors police. People spying on me in my street. You know, none of them admit to it. But I that you know, my neighbors they, but it's my it's mainly them at number nine. But I've seen them talking to the ones that number six and across the road as well.",id,,-2,0
105_2,T,"You know, so what, when did things start to go wrong?",irq,,,1
105_3,P,"I don't know. I mean, you'd have to ask them well, when they started properly, like deciding that they wanted, they wanted me out of the street. I think it was a few months ago. months it's been going on for months.",id,,,0
105_4,T,What makes you think they want you out the street?,irq,,,1
105_5,P,"Well, it's it's the harassment. It's the spying on me putting bugs in my, in my house in my phone. You know, and that, you know, that at first I thought I couldn't hear it. But now they know that I know that they're, you know, saying things say things about me through the window. You know, talking about what I'm doing. I know, I know. I know that doing it. You know, whenever I leave my front door woman at number seven, she's always there. What you know, she's clocking where I'm going, what I'm doing.",id,,-2,0
105_6,T,Why do you think they're doing that?,irq,,,1
105_7,P,"Well, I don't know. They're just I don't know what I think they want me out. I think they're, I think they're testing me. And they're trying to, they're trying to find out how far they can push me basically. It's all part of some, some tests. I want to know what for, you know, you'd have to ask them. That's what I've said to the police time and time again. I've said to him Why Why are you asking me these questions? Why don't you just talk to them?",id,,,0
105_8,T,You said your phone was clicking What was that about?,irq,,,1
105_9,P,"a landline. Yeah, yeah. Somebody rings me or I ring somebody between seven and 10 seconds in. I click, click, click, click, click click every time. ",id,,,0
105_10,T,Any other explanation for that?,irq,,,1
105_11,P," I don't know. Well, well, if could be but you know, every single time and then and then they're talking to me, and then they know what I've been saying down the phone.",id,,,0
105_12,T,"You know, where are they talking to you?",irq,,,1
105_13,P,"Well, I can hear him next door. Always on the phone again, always reading that book again. You know, I can hear him saying it. And they know that I can hear them and that's why they're doing it.",id,,,0
105_14,T,"Okay, so just to summarize at this point, your your phones Something's happening to telephone, you can hear your neighbors talking about what you're doing, making a commentary on your actions every day, every day. And you feel that there's some sort of reason for their actions doing this. Any other things that you've got problems with?",irq,,,1
